<?xml version="1.0" encoding="UTF-8" ?>
<students
        xmlns="http://www.xml.com/xml-schema"
        xmlns:xsi="http://www.w3.org/2001/XMLSchema-instance"
        xsi:schemaLocation="http://www.xml.com/xml-schema student.xsd"
>
    <student id="6666">
        <name>Mike</name>
        <age>18</age>
        <class>1</class>
        <score>
            <chinese>87</chinese>
            <math>77</math>
            <english>91</english>
        </score>
    </student>
    <student id="6667">
        <name>Rose</name>
        <age>17</age>
        <class>2</class>
        <score>
            <chinese>91</chinese>
            <math>92</math>
            <english>94</english>
        </score>
    </student>
</students>